<?xml version="1.0" encoding="utf-8"?>
<!-- <?xml-model href="iqram.dtd"?> -->
<!-- <!DOCTYPE isdb SYSTEM "iqram.dtd"> -->
<!-- <?xml-model href="First.xsd"?> -->
<isdb xmlns:xsi="http://www.w3.org/2001/XMLSchema-instance"
 xsi:noNamespaceSchemaLocation="First.xsd">
    <round>
        <batch>62</batch>
        <student>
            <name>Iqramul</name>
            <age>20</age>
            <address>
                <district>Dhaka</district>
                <thana>Araihazari</thana>
                <village>Mahmudpur</village>
            </address>
        </student>
        <student>
            <name>Omar Faruq</name>
            <age>21</age>
            <address>456 Elm St.</address>
        </student>
        <student>
            <name>Bithy</name>
            <age>22</age>
            <address>789 Oak St.</address>
        </student>
        <student>
            <name>Meme</name>
            <age>23</age>
            <address>1011 Pine St.</address>
        </student>
    </round>
    <round>
        <batch>46</batch>
        <student>
            <name>Parves</name>
            <age>20</age>
            <address>
                <district>Rajbari</district>
                <thana>Rajbari</thana>
                <village>Mahmudpur</village>
            </address>
        </student>
    </round>
    <round>
        <batch>85</batch>
        <student>
            <name>Iqramul</name>
            <age>20</age>
            <address>
                <district>Dhaka</district>
                <thana>Araihazari</thana>
                <village>Mahmudpur</village>
            </address>
        </student>
    </round>
</isdb>